{
  "base": {
    "schema_version": "1.0",
    "artifact_id": "art-val-001",
    "artifact_class": "validation_command_packet",
    "repo_id": "forge-command",
    "title": "ForgeCommand validation command packet",
    "operational_purpose": "Provide exact validation commands for the bounded proof slice",
    "summary_block": "Use cargo test and cargo check as bounded proof-slice validation commands.",
    "source_refs": [
      "Cargo.toml",
      "src/lib.rs"
    ],
    "source_ref_hashes": [
      "hash-cargo",
      "hash-lib"
    ],
    "authority_level": "strong_derived",
    "lifecycle_state": "approved",
    "freshness_state": "fresh",
    "critic_status": "passed",
    "admissibility_state": "admissible",
    "related_artifact_refs": [],
    "supersedes_artifact_id": null,
    "protocol_refs": [
      "BDS_BACKEND_ENGINEERING_PROTOCOL"
    ],
    "created_at": "2026-04-09T00:00:00-04:00",
    "last_validated_at": "2026-04-09T00:00:00-04:00",
    "producer_identity": "proof-slice-core",
    "sensitivity_classification": "internal_general"
  },
  "commands": [
    "cargo test",
    "cargo check"
  ],
  "execution_order": [
    "cargo check",
    "cargo test"
  ],
  "expected_pass_conditions": [
    "all unit tests pass",
    "crate compiles cleanly"
  ],
  "environment_requirements": [
    "rust toolchain installed",
    "run from repo root"
  ]
}
